{
  "$schema": "https://json-schema.org/draft/2020-12/schema",
  "$id": "https://replication-skill.dev/schemas/replication.config.schema.json",
  "title": "ReplicationConfig",
  "type": "object",
  "additionalProperties": false,
  "required": ["schemaVersion", "adapter", "source", "target", "outputDir"],
  "properties": {
    "schemaVersion": { "type": "integer", "const": 1 },
    "adapter": {
      "type": "string",
      "enum": [
        "canvas-export",
        "site-crawl",
        "router-migration",
        "url-pairs",
        "dc-html",
        "static-site",
        "framework-migration"
      ]
    },
    "source": {
      "type": "object",
      "additionalProperties": false,
      "required": ["entry"],
      "properties": {
        "entry": { "type": "string", "minLength": 1 },
        "screenDefinitions": {
          "type": "string",
          "description": "Curated slug/state manifest (required for canvas-export until full auto-catalog)"
        },
        "crawl": {
          "type": "object",
          "description": "site-crawl options: seed paths, BFS depth/page limits, and allow/deny globs (see src/adapters/site-crawl/discover.ts SiteCrawlOptions)",
          "additionalProperties": false,
          "properties": {
            "seeds": {
              "type": "array",
              "items": { "type": "string" },
              "description": "Extra seed paths relative to the entry origin. Default: [\"/\"]."
            },
            "maxDepth": {
              "type": "integer",
              "minimum": 0,
              "description": "BFS depth limit; seed pages are depth 0. Default: 2."
            },
            "maxPages": {
              "type": "integer",
              "minimum": 0,
              "description": "Safety cap on total fetch attempts for one crawl. Default: 500."
            },
            "allowPatterns": {
              "type": "array",
              "items": { "type": "string" },
              "description": "If non-empty, only discovered links whose path matches at least one glob are followed/kept."
            },
            "denyPatterns": {
              "type": "array",
              "items": { "type": "string" },
              "description": "Discovered links whose path matches any glob here are never followed/kept. Deny wins over allow."
            }
          }
        }
      }
    },
    "design": {
      "type": "object",
      "additionalProperties": false,
      "required": ["baseUrl"],
      "properties": {
        "baseUrl": {
          "type": "string",
          "description": "Design ground truth origin (static reference server or live design URL)"
        },
        "kind": { "type": "string", "enum": ["url", "reference"] }
      }
    },
    "target": {
      "type": "object",
      "additionalProperties": false,
      "required": ["baseUrl"],
      "properties": {
        "stack": {
          "type": "string",
          "description": "Optional free-form label for the target implementation's framework/language (e.g. \"next-app-router\", \"vite\", \"rails\", \"django\", \"plain-html\"). Not read by any command logic today — purely descriptive, so any string is accepted."
        },
        "baseUrl": {
          "type": "string",
          "description": "Implementation origin (dev server or production preview)"
        },
        "localePrefix": {
          "type": "string",
          "description": "Optional locale segment prepended to catalog livePath during compare"
        },
        "routesFile": {
          "type": "string",
          "description": "JSON manifest of implemented routes for replicate surplus"
        }
      }
    },
    "outputDir": {
      "type": "string",
      "default": ".replication",
      "description": "Workspace-relative dir for catalog, routes, reference"
    },
    "viewports": {
      "type": "array",
      "items": {
        "type": "object",
        "required": ["name", "width", "height"],
        "properties": {
          "name": { "type": "string" },
          "width": { "type": "integer", "minimum": 320 },
          "height": { "type": "integer", "minimum": 320 }
        }
      }
    },
    "catalog": {
      "type": "object",
      "properties": {
        "maxStates": { "type": "integer", "minimum": 1, "default": 256 }
      }
    }
  }
}
