{
  "schemaVersion": 1,
  "adapter": "canvas-export",
  "source": {
    "entry": "../../test/fixtures/minimal.canvas-export",
    "screenDefinitions": "screen-definitions.json"
  },
  "target": {
    "stack": "next-app-router",
    "baseUrl": "http://127.0.0.1:3000"
  },
  "outputDir": ".replication",
  "viewports": [
    { "name": "desktop", "width": 1920, "height": 1080 },
    { "name": "mobile", "width": 390, "height": 844 }
  ],
  "catalog": { "maxStates": 256 }
}
